proceeding_code,ccms_proceeding_code,ccms_category_of_law_code,ccms_category_of_law,ccms_matter_type_code,ccms_matter_type,Meaning/ Proceeding - CURRENT,proceeding_meaning,proceeding_description
PR0200,DA006,MAT,Family,MINJN,Domestic Abuse,"Extend, vary, dis — Part IV ","Extend, variation or discharge - Part IV ","to be represented on an application to extend, vary or discharge an order under Part IV Family Law Act 1996. "
PR0203,DA007,MAT,Family,MINJN,Domestic Abuse,Forced Marriage Protection Order ,Forced marriage protection order ,to be represented on an application for a forced marriage protection order
PR0206,DA003,MAT,Family,MINJN,Domestic Abuse,Harassment – injunction ,Harassment - injunction ,to be represented in an action for an injunction under section 3 Protection from Harassment Act 1997.
PR0208,DA001,MAT,Family,MINJN,Domestic Abuse,Inherent jurisdiction High Ct injunction,Inherent jurisdiction high court injunction,"to be represented on an application for an injunction, order or declaration under the inherent jurisdiction of the court."
PR0211,DA004,MAT,Family,MINJN,Domestic Abuse,Non-molestation order ,Non-molestation order ,to be represented on an application for a non-molestation order.
PR0214,DA005,MAT,Family,MINJN,Domestic Abuse,Occupation order,Occupation order,to be represented on an application for an occupation order.
PR0217,DA002,MAT,Family,MINJN,Domestic Abuse,Vary/discharge S5 PHA 1997 ,Variation or discharge under section 5 protection from harassment act 1997 ,to be represented on an application to vary or discharge an order under section 5 Protection from Harassment Act 1997 where the parties are associated persons (as defined by Part IV Family Law Act 1996).
PR0220,DA020,MAT,Family,MINJN,Domestic Abuse,FGM Protection Order-Domestic Abuse ,FGM Protection Order-Domestic Abuse ,To be represented on an application for a Female Genital Mutilation Protection Order under the Female Genital Mutilation Act.
